{
  "$schema": "https://json-schema.org/draft/2020-12/schema",
  "$id": "oreflow-learning-v1",
  "title": "oreflow-learning-v1",
  "type": "object",
  "properties": {
    "schema": {
      "const": "oreflow.learning/v1",
      "type": "string"
    },
    "features": {
      "type": "array"
    },
    "targets": {
      "type": "array"
    },
    "models": {
      "type": "array"
    },
    "design": {
      "type": "object"
    },
    "settings": {
      "type": "object"
    },
    "identity": {
      "type": "object"
    },
    "interpolation": {
      "type": "object"
    },
    "guard": {
      "type": "object"
    },
    "leave_one_case_out": {
      "type": "array"
    },
    "transfer_groups": {
      "type": "object"
    },
    "leave_one_group_out": {
      "type": "array"
    },
    "equal_rows": {
      "type": "object"
    },
    "mlp_seeds": {
      "type": "object"
    },
    "summary": {
      "type": "object"
    },
    "final": {
      "type": "object"
    },
    "seconds": {
      "type": "number"
    },
    "engine_version": {
      "type": "string"
    },
    "contract_digest": {
      "type": "string"
    }
  },
  "required": [
    "schema",
    "features",
    "targets",
    "models",
    "design",
    "settings",
    "identity",
    "interpolation",
    "guard",
    "leave_one_case_out",
    "transfer_groups",
    "leave_one_group_out",
    "equal_rows",
    "mlp_seeds",
    "summary",
    "final",
    "seconds",
    "engine_version",
    "contract_digest"
  ],
  "additionalProperties": true
}
