{"schema":"oreflow.learning/v1","features":["log_payable_fraction","specific_throughput_t_h_mw","target_p80_um","circulating_load","water_m3_t","crusher_css_mm","work_index_kwh_t","carrier_liberation_um","grind_to_liberation","carrier_composite_content","carrier_density_t_m3","carrier_floatability","dose_ratio","jg_cm_s","rougher_cells","rougher_volume_m3_per_tph","gravity_bleed","deslime_cut_um","has_flotation","has_gravity","has_magnetic","has_desliming"],"targets":["recovery_pct","log_upgrade","specific_energy_total_kwh_t"],"models":["ridge","random_forest","hist_gradient_boosting","gaussian_process","mlp"],"design":{"per_case":256,"cases":["copper_porphyry_soft","copper_porphyry_hard","gold_free_milling","iron_magnetite_fine","nickel_sulphide","phosphate_clay","copper_molybdenum","copper_oxide","zinc_sulfide","mixed_ore_high_clay","low_grade_copper","refractory_gold"],"rows":3072,"seed":20260927,"seconds":895.4586591999978,"method":"scrambled Sobol over each case's Contract 1 envelope and ore factors"},"settings":{"design_points_per_case":256,"seed":20260927,"test_fraction":0.2,"validation_fraction":0.15,"ridge_alpha":1.0,"forest_trees":300,"forest_min_leaf":2,"hgb_iterations":300,"hgb_learning_rate":0.05,"gp_training_rows":500,"gp_restarts":2,"interval_z":1.959963984540054,"mlp_hidden":[64,64],"mlp_learning_rate":0.003,"mlp_weight_decay":0.0001,"max_epochs":3000,"patience":150,"autoencoder_hidden":[16,6,16],"guard_quantile":0.99,"ood_shift":0.5,"permutation_repeats":10,"onnx_tolerance":1e-05,"gp_noise_initial":0.001,"gp_noise_bounds":[1e-09,10.0],"gp_length_scale_bounds":[0.01,100000.0],"gp_bound_margin":0.99,"ood_shifts":[0.02,0.05,0.1,0.25,0.5,1.0],"mlp_seed_offsets":[0,11,22,33,44],"device":"auto"},"identity":{"ridge":"sklearn.linear_model._ridge.Ridge","random_forest":"sklearn.ensemble._forest.RandomForestRegressor","hist_gradient_boosting":"sklearn.ensemble._hist_gradient_boosting.gradient_boosting.HistGradientBoostingRegressor","gaussian_process":"sklearn.gaussian_process._gpr.GaussianProcessRegressor","mlp":"torch.nn.Sequential (cuda)"},"interpolation":{"train_rows":2460,"test_rows":612,"models":{"ridge":{"recovery_pct":{"rmse":9.459918047312241,"mae":6.825178614148737,"r2":0.6172481366014071,"rows":612,"r2_within_case":0.4981122026903634},"log_upgrade":{"rmse":0.2357231270502045,"mae":0.18474065381566,"r2":0.7613585508774107,"rows":612,"r2_within_case":-3.0659499908465655},"specific_energy_total_kwh_t":{"rmse":2.2020579974839594,"mae":1.6325625294822743,"r2":0.793528359794202,"rows":612,"r2_within_case":0.5986664459306059}},"random_forest":{"recovery_pct":{"rmse":6.492269438567645,"mae":4.538428498592093,"r2":0.8197249451626675,"rows":612,"r2_within_case":0.7636122542192295},"log_upgrade":{"rmse":0.0344841604799149,"mae":0.02299832996551081,"r2":0.9948928242270582,"rows":612,"r2_within_case":0.9129844318177196},"specific_energy_total_kwh_t":{"rmse":0.9233551872892906,"mae":0.6494989604789861,"r2":0.963697169479909,"rows":612,"r2_within_case":0.9294356165288126}},"hist_gradient_boosting":{"recovery_pct":{"rmse":4.602569258342192,"mae":3.178473739881051,"r2":0.9093968639162031,"rows":612,"r2_within_case":0.8811955923749809},"log_upgrade":{"rmse":0.029495191598323076,"mae":0.01806465324996923,"r2":0.9962636811286486,"rows":612,"r2_within_case":0.93634095947445},"specific_energy_total_kwh_t":{"rmse":0.7224857631297944,"mae":0.5144022240518819,"r2":0.9777739908598677,"rows":612,"r2_within_case":0.9567977314845895}},"gaussian_process":{"recovery_pct":{"rmse":5.344463732049666,"mae":3.599978991124745,"r2":0.8778338650301478,"rows":612,"r2_within_case":0.8398082458921968,"coverage_95":0.9068627450980392,"mean_half_width":7.549495413363352,"training_rows":500,"kernel":"4.62**2 * RBF(length_scale=[3.18, 5.17, 8.18, 33.4, 25.1, 13.4, 6.59, 62.5, 1e+05, 7.85, 5.56e+04, 11.3, 1.61, 33.5, 48.1, 6.31, 8.61e+04, 19.9, 0.988, 18.7, 0.988, 8.14]) + WhiteKernel(noise_level=0.0297)","length_scales":{"log_payable_fraction":3.1793835795873493,"specific_throughput_t_h_mw":5.167834315111642,"target_p80_um":8.179511589882216,"circulating_load":33.44907467733096,"water_m3_t":25.106213512498933,"crusher_css_mm":13.368700317342867,"work_index_kwh_t":6.593778783071978,"carrier_liberation_um":62.49509782730769,"grind_to_liberation":100000.00000000001,"carrier_composite_content":7.853685136032905,"carrier_density_t_m3":55637.65508985955,"carrier_floatability":11.253619031709366,"dose_ratio":1.6084639637852614,"jg_cm_s":33.50824346089092,"rougher_cells":48.088403951694644,"rougher_volume_m3_per_tph":6.313453105000291,"gravity_bleed":86116.19319737598,"deslime_cut_um":19.88526678924567,"has_flotation":0.988449742460708,"has_gravity":18.734201879039787,"has_magnetic":0.988449742460708,"has_desliming":8.14054093490207},"switched_off":["grind_to_liberation"],"noise_level":0.029699153478414075,"optimizer_notes":1},"log_upgrade":{"rmse":0.023771145966857032,"mae":0.014551369917259988,"r2":0.997573156740567,"rows":612,"r2_within_case":0.958651678638572,"coverage_95":0.9133986928104575,"mean_half_width":0.031113932984622516,"training_rows":500,"kernel":"1.63**2 * RBF(length_scale=[1.1, 9.61, 4.57e+04, 118, 47.8, 353, 152, 49.2, 44.1, 1.72, 2.05, 15.4, 3, 64.6, 35.1, 6.99e+04, 35.3, 91.1, 1.01, 0.572, 1.01, 5.68]) + WhiteKernel(noise_level=0.000488)","length_scales":{"log_payable_fraction":1.0950673464637042,"specific_throughput_t_h_mw":9.607210568818733,"target_p80_um":45656.19978323462,"circulating_load":117.80247446449572,"water_m3_t":47.7530760438984,"crusher_css_mm":353.25218003818327,"work_index_kwh_t":152.16982658049298,"carrier_liberation_um":49.16135643341876,"grind_to_liberation":44.1051436052925,"carrier_composite_content":1.7156680687856556,"carrier_density_t_m3":2.0521043585616265,"carrier_floatability":15.386483989401276,"dose_ratio":2.996671925599346,"jg_cm_s":64.57205893785611,"rougher_cells":35.06865611051365,"rougher_volume_m3_per_tph":69884.58496411127,"gravity_bleed":35.324295752716004,"deslime_cut_um":91.08666986756297,"has_flotation":1.0090768126156182,"has_gravity":0.5718783125327094,"has_magnetic":1.0090768126156182,"has_desliming":5.680078966191176},"switched_off":[],"noise_level":0.0004883626851652081,"optimizer_notes":0},"specific_energy_total_kwh_t":{"rmse":0.6472931065514032,"mae":0.455188124154581,"r2":0.9821595885836385,"rows":612,"r2_within_case":0.9653223284677163,"coverage_95":0.9362745098039216,"mean_half_width":1.2137870960840624,"training_rows":500,"kernel":"1.83**2 * RBF(length_scale=[59.5, 1.39, 1.57, 12.1, 10, 9.72, 2.23, 70.8, 1e+05, 48.3, 38.2, 44.6, 1e+05, 95.9, 1.21e+04, 54.4, 1e+05, 1e+05, 2.87e+04, 95.1, 2.87e+04, 52.5]) + WhiteKernel(noise_level=0.0106)","length_scales":{"log_payable_fraction":59.51316552826898,"specific_throughput_t_h_mw":1.38888075864552,"target_p80_um":1.571868761405188,"circulating_load":12.139847303120002,"water_m3_t":10.014286411642978,"crusher_css_mm":9.724289056287827,"work_index_kwh_t":2.2338018318049797,"carrier_liberation_um":70.76204670519321,"grind_to_liberation":100000.00000000001,"carrier_composite_content":48.3420849459187,"carrier_density_t_m3":38.22210314015191,"carrier_floatability":44.55853370726169,"dose_ratio":99997.98193476931,"jg_cm_s":95.9273105475442,"rougher_cells":12118.330667388638,"rougher_volume_m3_per_tph":54.39701329845658,"gravity_bleed":100000.00000000001,"deslime_cut_um":100000.00000000001,"has_flotation":28678.50732813644,"has_gravity":95.10881992618775,"has_magnetic":28678.50732813644,"has_desliming":52.45298672453716},"switched_off":["grind_to_liberation","dose_ratio","gravity_bleed","deslime_cut_um"],"noise_level":0.010619521742604367,"optimizer_notes":4}},"mlp":{"recovery_pct":{"rmse":3.3815613536007247,"mae":1.6745110532015475,"r2":0.9510923147548509,"rows":612,"r2_within_case":0.9358692333951126},"log_upgrade":{"rmse":0.02421270028739403,"mae":0.01606994809357525,"r2":0.9974821610792415,"rows":612,"r2_within_case":0.9571013033383308},"specific_energy_total_kwh_t":{"rmse":0.42309557956852556,"mae":0.2655548289336312,"r2":0.9923778081222587,"rows":612,"r2_within_case":0.9851842056708431}}},"mlp_training":{"device":"cuda","epochs_run":3000,"best_epoch":2985,"best_validation_mse":0.010951319709420204,"stopped_early":false,"validation_rows":369,"fit_rows":2091,"validation_history":[0.9807499647140503,0.43980875611305237,0.2904757559299469,0.19653446972370148,0.16659338772296906,0.1485140472650528,0.1328248679637909,0.11778198927640915,0.10432535409927368,0.09334976971149445,0.08470980823040009,0.07823477685451508,0.07361748069524765,0.07005320489406586,0.06718412041664124,0.0647585391998291,0.0625007301568985,0.060299601405858994,0.05810272693634033,0.05576649308204651,0.0546705462038517,0.0520876869559288,0.05047847330570221,0.0486682765185833,0.04758159816265106,0.04544847831130028,0.044042594730854034,0.04276086762547493,0.04335029795765877,0.040129099041223526,0.03885672613978386,0.03760918229818344,0.03642061725258827,0.03671380504965782,0.03412546217441559,0.03310052677989006,0.032013244926929474,0.031040988862514496,0.030067596584558487,0.029170790687203407,0.02844558097422123,0.027678584679961205,0.02699705958366394,0.02615787833929062,0.025543224066495895,0.024931082502007484,0.02433585561811924,0.02378455549478531,0.023260150104761124,0.022795993834733963,0.0227370485663414,0.02241126075387001,0.02175363339483738,0.02122635208070278,0.02077048271894455,0.020417731255292892,0.020023712888360023,0.01965511590242386,0.01952614262700081,0.01905190385878086,0.018916543573141098,0.018524231389164925,0.018191957846283913,0.017968395724892616,0.017623629420995712,0.017531882971525192,0.0171319879591465,0.017124852165579796,0.016733352094888687,0.016676342114806175,0.016423039138317108,0.01615305058658123,0.01674513891339302,0.015709659084677696,0.01577421836555004,0.015667634084820747,0.015443450771272182,0.015273449942469597,0.015076979994773865,0.014972783625125885,0.014881232753396034,0.015221798792481422,0.014858580194413662,0.014